"[BRWN, PARA#14336, SENT#2]","He muttered , and took off , obviously feeling like a fool .","male","fool","0.16666666666666666","3","NO"
"[BRWN, PARA#3844, SENT#1]","Keys's findings , though far from complete , are likely to smash many an eating cliche .","","","0.0","0","NO"
"[BRWN, PARA#3410, SENT#2]","It holds an equally valuable lesson for a society where the word `` intellectual '' has become a term of opprobrium to millions of well-meaning people who somehow imagine that it must be destructive of the simpler human virtues .","","","0.0","0","NO"
"[BRWN, PARA#11049, SENT#3]","There was the smell of the coast , like a primeval memory , composed of equal parts salt water , clams , seaweed and northern air .","smell","memory","0.1111111111111111","5","NO"
"[BRWN, PARA#11296, SENT#1]","`` Your dad sounds like a good father and a good policeman .","dad","father","0.5","5","NO"
"[BRWN, PARA#7751, SENT#6]","Alfred , who was a good deal older than Harry , had treated him like a son , and when Harry decided to stay in business with Lew instead of going with Alfred , Alfred looked on the decision as a betrayal .","person","son","0.25","5","NO"
"[BRWN, PARA#9545, SENT#2]","Although it is in some ways comparable to a voluntary sale of assets for cash , to which section 203 quite clearly applies , the courts and Treasury have held that acquiring corporations in several types of non-taxable reorganizations may sue for refund of taxes paid by transferors .","","","0.0","0","NO"
"[BRWN, PARA#14288, SENT#1]","It was so pretty and artless that she felt like a child again and would have enjoyed running out barefoot to play on the wet grass with all the growing things , but Doaty never permitted bare feet and she was decidedly not a child but une femme d'un certain age .","female","child","0.16666666666666666","5","NO"
"[BRWN, PARA#3533, SENT#1]","But what is equally impressive is the delicacy and wonderful lyric quality of both the band and Mulligan's baritone sax in a fragile ballad like Bob Brookmeyer's arrangement of `` Django's Castle '' .","","","0.0","0","NO"
"[BRWN, PARA#6695, SENT#1]","His political opponent and lifetime friend , Thomas Jefferson , achieved immortality through his authorship of the Declaration of Independence , but equally notable were the legal and constitutional reforms he instituted in his native Virginia , his role as father of our territorial system , and his acquisition of the Louisiana Territory during his first term as President .","","","0.0","0","NO"
"[BRWN, PARA#5083, SENT#1]","Not only should every educator above the rank of instructor be expected to be a member of one of the professional organizations , but his first qualification for membership as an educator should be so sharply scrutinized that membership would be equivalent to certification to teach the subject .","","","0.0","0","NO"
"[BRWN, PARA#6580, SENT#1]","Whether a concept analogous to the principle of internal responsibility operates in a nation's external relations is less obvious and more difficult to establish .","","","0.0","0","NO"
"[BRWN, PARA#10901, SENT#2]","For the oyabun to make such a trip was either a sign of great weakness or an indication of equally great confidence , and from all the available information it was probably the latter .","","","0.0","0","NO"
"[BRWN, PARA#12448, SENT#1]","`` I ought to be asleep , too , but I felt like a snack .","person","snack","0.1111111111111111","5","NO"
"[BRWN, PARA#11993, SENT#9]","That was more like a thought , but not a great deal more .","thing","thought","0.1111111111111111","5","NO"
"[BRWN, PARA#11057, SENT#2]","He was like a mean horse to come at from the rear .","male","horse","0.1","5","NO"
"[BRWN, PARA#9728, SENT#3]","then we shall perhaps be in a position to provide something like a complete answer to the question at hand .","","","0.0","0","NO"
"[BRWN, PARA#14753, SENT#2]","`` Why don't you paint it red and white like a barber pole '' ? ?","person","pole","0.1111111111111111","5","NO"
"[BRWN, PARA#9015, SENT#1]","In the lower portion of each Chart , the Skeletal Age ( Hand ) of boy 34 and girl 2 may be similarly classified .","","","0.0","0","NO"
"[BRWN, PARA#14300, SENT#2]","Next to the Blackwells , Titus had owned the island most , and she and Adelia had often stood in front of him , silenced by his terrible years -- a scanty man with a thin beard and very deep-set blue eyes like a mariner , more aged than possible .","female","mariner","0.125","2","NO"
"[BRWN, PARA#4502, SENT#6]","Any fraction of an inch involved in the measurement must be converted to a decimal equivalent to simplify the mathematics .","","","0.0","0","NO"
"[BRWN, PARA#11606, SENT#1]","She was a large woman with a frizzled gray poodle cut and a pencil clamped like a bit between her teeth while she hunted and pecked on an old typewriter .","","","0.0","0","NO"
"[BRWN, PARA#9931, SENT#3]","like an ominous bird a-wing '' , or `` wrings with wrong '' , or would describe a winter sun as `` God-curst '' .","","","0.0","0","NO"
"[BRWN, PARA#11286, SENT#6]","You've treated your stay here like a big joke .","person","joke","0.1111111111111111","5","NO"
"[BRWN, PARA#10005, SENT#2]","Since experience indicates that effluents from oxidation ponds do not create major problems at these BOD concentrations , the goal for the effluent quality of the accelerated treatment system was the same as from conventional oxidation ponds .","","","0.0","0","NO"
"[BRWN, PARA#6553, SENT#1]","It is clear that non-violent resistance is a mode of action in need of justification and limitation in Christian morality , like any other form of resistance .","thing","form","0.1","5","NO"
"[BRWN, PARA#9347, SENT#4]","Or , equally often , a concretistic-seeming , particularistic-seeming statement may consist , with its mundane exterior , in a form of poetry -- may be full of meaning and emotion when interpreted as a figurative expression : a metaphor , a smile , an allegory , or some other symbolic mode of speaking .","","","0.0","0","NO"
"[BRWN, PARA#10194, SENT#2]","A moment's reflection shows that the above algorithm and presentation work equally well in this case .","","","0.0","0","NO"
"[BRWN, PARA#14479, SENT#17]","Yet he walked like a young man .","male","man","0.16666666666666666","5","NO"
"[BRWN, PARA#5393, SENT#5]","After the first two were blacked out , the third light was abandoned by a terrified Italian crew , who left their light to shine for nine minutes like an unerring homing beacon until British MP's shot it out .","","","0.0","0","NO"
"[BRWN, PARA#12850, SENT#4]","Clayton lifted him gently into the saddle , like a child .","person","child","0.3333333333333333","5","NO"
"[BRWN, PARA#6112, SENT#7]","Though by no means an ideal procedure , a red wine may similarly be brought from the cellar to the dining room and opened twenty minutes or so before serving time .","","","0.0","0","NO"
"[BRWN, PARA#5474, SENT#3]","It seemed like a good time for officials to use a recently-passed law empowering the post office department to contract for the transport of first class mail by air .","thing","time","0.1","5","NO"
"[BRWN, PARA#13550, SENT#5]","Would you like a drink , or coffee '' ? ?","","","0.0","0","NO"
"[BRWN, PARA#12489, SENT#7]","The sooner you act like an angel the quicker you'll feel angelic .","person","angel","0.09090909090909091","2","NO"
"[BRWN, PARA#7410, SENT#10]","Again , Henley's attitude of defiance which colors his ideal of self-mastery is far from characteristic of a Stoic thinker like Marcus Aurelius , whose gentle acquiescence is almost Christian , comparable to the patience expressed in Milton's sonnet on his own blindness .","attitude","person","0.125","5","NO"
"[BRWN, PARA#11013, SENT#1]","He was tired , he had his business worries , and the sight of his wife arranging pork chops in the broiler only seemed like an extension of a boring day .","sight","extension","0.07692307692307693","5","NO"
"[BRWN, PARA#12441, SENT#4]","Repeating it like a student telling himself that the jewel is in the lotus he sank into nirvana .","male","student","0.16666666666666666","3","NO"
"[BRWN, PARA#5228, SENT#13]","We also have an ' engineering section head -- research engineer ' classification which has salary possibilities equivalent to that of a research engineer .","","","0.0","0","NO"
"[BRWN, PARA#10381, SENT#4]","But it also looked like a toad , hopping away from the light .","thing","toad","0.0625","5","NO"
"[BRWN, PARA#9388, SENT#6]","and somewhat similarly for plants , 16 as against 4 .","","","0.0","0","NO"
"[BRWN, PARA#418, SENT#1]","Split badly during the recent presidential election into almost equally divided camps of party loyalists and independents , the Democratic party in Mississippi is currently a wreck .","","","0.0","0","NO"
"[BRWN, PARA#7929, SENT#7]","While he is worldly , the musician often cultivates public attitudes of childlike astonishment and naivete .","","","0.0","0","NO"
"[BRWN, PARA#12389, SENT#6]","The man was uncanny , like a shadow , and made as much noise as a shadow .","man","shadow","0.07142857142857142","5","NO"
"[BRWN, PARA#11896, SENT#4]","Thornburg added in a lower voice but Andy overheard , `` They act more like a jury than an audience '' .","people","jury","0.2","2","NO"
"[BRWN, PARA#4508, SENT#7]","Fury has made a few mistakes but looks like a wonderful prospect , with his impressive gait and stride which certainly make him cover the ground .","person","prospect","0.09090909090909091","3","NO"
"[BRWN, PARA#9271, SENT#5]","This comment and others similar to it , would seem to indicate a possible justification for continuing the status quo .","","","0.0","0","NO"
"[BRWN, PARA#15420, SENT#5]","The suicide attempt looked to him like an opportunity to put his theory to the test .","attempt","opportunity","0.09090909090909091","5","NO"
"[BRWN, PARA#12554, SENT#2]","And it might be , considering the uncomfortable custom the Angels had of thinking of everything in terms of absolutes , that the proposal of anything less might well amount instead to something like a declaration of war .","proposal","declaration","0.25","2","NO"
"[BRWN, PARA#14287, SENT#4]","On a thrusting spray thick with thorns and dewdrops and swelling pink buds , like a summer Valentine , a bird balanced and sang , nondescriptly brown and alive with its own music , a little engine of song .","bird","person","0.16666666666666666","5","NO"
"[BRWN, PARA#9081, SENT#4]","If this is the case , one would expect that not only the various procedures just mentioned which alter the hypothalamic balance would influence emotional state and behavior but that emotion itself would act likewise .","","","0.0","0","NO"
"[BRWN, PARA#9021, SENT#3]","Forty other figures similar to 5 and 6 and the original data used in the construction of all figures and tables in this monograph have been included in the Appendix .","","","0.0","0","NO"
"[BRWN, PARA#12216, SENT#3]","Springing like a cat , he leaped back , swooped up the spring gun and , whirling , pointed it toward the cabin .","male","cat","0.1111111111111111","3","NO"
"[BRWN, PARA#8539, SENT#3]","This aircraft , which was planned for initial operational use about 1965 , would be complementary to but likewise competitive with the four strategic ballistic missile systems , all of which are scheduled to become available earlier .","","","0.0","0","NO"
"[BRWN, PARA#6570, SENT#11]","It is extraordinary that a people as proud and warlike as Southerners should have been as docile as they have .","","","0.0","0","NO"
"[BRWN, PARA#8950, SENT#1]","In the present work whole sera have been fractionated by chromatography on DEAE-cellulose using single gradients similar to those described by Sober and Peterson , and certain chemical and serological properties of the fractions containing antibodies of the ABO and Rh systems have been described .","","","0.0","0","NO"
"[BRWN, PARA#13551, SENT#2]","She stood up , pulled the coat from her shoulders and started to slide it off , then let out a high-pitched scream and I let out a low-pitched , wobbling sound like a muffler blowing out .","person","muffler","0.1111111111111111","2","NO"
"[BRWN, PARA#5764, SENT#2]","What we have here is in some ways more like an ordinary conversation .","","","0.0","0","NO"
"[BRWN, PARA#9059, SENT#2]","The intermediate sera were also similarly absorbed with tissue powder .","","","0.0","0","NO"
"[BRWN, PARA#7942, SENT#11]","And it is also a fact of life that there will always ( be youngish half-educated people around , who will be dazzled by the glitter of what looks like a literary movement .","glitter","movement","0.07692307692307693","4","NO"
"[BRWN, PARA#12968, SENT#4]","Coming over the wall he had seemed like a hideous devil .","male","devil","0.06666666666666667","5","NO"
"[BRWN, PARA#5656, SENT#1]","In the morning she found rooms directly across from the Excelsior at the equally luxurious Hotel Ambassador .","","","0.0","0","NO"
"[BRWN, PARA#12967, SENT#5]","It sounded like a man kicking a melon .","thing","man","0.09090909090909091","5","NO"
"[BRWN, PARA#1967, SENT#2]","Once more the fallacious equation is advanced to argue that since business is restricted under the anti-monopoly laws , there must be a corresponding restriction against labor unions : the law must treat everybody equally .","","","0.0","0","NO"
"[BRWN, PARA#8516, SENT#2]","Similar restrictions on the strength of the Army National Guard contained in the 1960 Department of Defense Appropriation Act should likewise be dropped .","","","0.0","0","NO"
"[BRWN, PARA#9613, SENT#3]","A decision to refer workers to jobs vacant because of a strike would have to be applied equally to nonagricultural situations , and might in effect place the public employment services in the position of acting as strikebreakers .","","","0.0","0","NO"
"[BRWN, PARA#10607, SENT#4]","He thought of Simms Purdew , who once had risen at the edge of a cornfield , a maniacal scream on his lips , and swung a clubbed musket like a flail to beat down the swirl of Rebel bayonets about him .","male","flail","0.1111111111111111","3","NO"
