"[BRWN, PARA#6846, SENT#8]","As in experience one is seized by given entities and their interrelations and is forced to respond in value feelings to them , so one is similarly seized in the mimetic presentation of images .","","","0.0","0","YES"
"[BRWN, PARA#10554, SENT#4]","Loneliness tore through him like a physical pain whenever he thought of Peter Robert , Nerien , Nicholas Cop , Martin Bucer , and even the compromising Louis Du Tillet .","person","pain","0.09090909090909091","5","YES"
"[BRWN, PARA#10318, SENT#6]","A fellow came up to me , a Senator , I don't have to tell you his name , and he told me , ' I love the President like a brother , but God damn it , he's crucifying me .","person","brother","0.2","2","YES"
"[BRWN, PARA#11031, SENT#1]","She grasped the chair arms and brought her thin body upright , like a bird alert for flight .","female","alert","0.07692307692307693","3","YES"
"[BRWN, PARA#13694, SENT#2]","Frozen , they stared at it whirling down the valley , gouging and spitting out boulders and chunks of earth like a starving hound dog cracking marrowbones .","thing","dog","0.07142857142857142","2","YES"
"[BRWN, PARA#8690, SENT#5]","The potential market for the machine should be comparable to that of the Unifil loom winder .","","","0.0","0","YES"
"[BRWN, PARA#6433, SENT#3]",") The curve of faded terra-cotta-colored houses in front of the church seems like a stage set .","curve","set","0.125","5","YES"
"[BRWN, PARA#13782, SENT#3]","It made only a tiny bump over the two men like a tire over a piece of gravel then moved on .","thing","tire","0.07142857142857142","5","YES"
"[BRWN, PARA#14038, SENT#3]","His heart was pounding like a mighty dynamo and he was trying to think , his mind seeming to scream at him like a hurt or frightened child , `` How will I do it ? ?","heart","dynamo","0.05","2","YES"
"[BRWN, PARA#4102, SENT#5]","One night there were some dried peas lying on our kitchen table , and these peas looked to me like a little group of atoms ; ;","pea","group","0.09090909090909091","2","YES"
"[BRWN, PARA#13933, SENT#1]","The marine slumped forward into a bow like a priest before an idol .","marine","priest","0.1111111111111111","5","YES"
"[BRWN, PARA#9361, SENT#2]","The order is identical to the ordering of the forms they describe .","","","0.0","0","YES"
"[BRWN, PARA#14704, SENT#5]","The closet was faintly fragrant with lavender , and as Lucy shut the door an unhappy memory slipped into her mind , like a lavender ghost : Greg's house , on the day he was buried , and the child , pale , silent , baffled , watching the funeral guests with panicky eyes .","memory","ghost","0.16666666666666666","5","YES"
"[BRWN, PARA#7754, SENT#1]","Alfred began to put his affairs in order , and he went about it like a man putting his things into storage .","male","man","0.16666666666666666","2","YES"
"[BRWN, PARA#9554, SENT#1]","There may be certain items which are quite similar to a net operating loss carryover or operating deficit and whose right to survive a reorganization should perhaps be subject to the conditions applicable to those items .","","","0.0","0","YES"
"[BRWN, PARA#13121, SENT#4]","It was a bold , dark castle of pine boughs that stood like a medieval fortress , eclipsing the sun and human time .","thing","fortress","0.07692307692307693","5","YES"
"[BRWN, PARA#9945, SENT#1]","It is not a farfetched analogy to say that this is what Thomas did to poetry .","","","0.0","0","YES"
"[BRWN, PARA#11078, SENT#10]","I always felt the memory was present in both of them , stirring in their chests like a laugh or a growl , as eager as an animal to be out .","memory","laugh","0.1","2","YES"
"[BRWN, PARA#14716, SENT#2]","Then she jumped to her feet , the elastic phone cord uncoiling like a black snake .","","","0.0","0","YES"
"[BRWN, PARA#15065, SENT#2]","Today , he looked like an Astronaut who had left his vitamin pills on the bureau and spent six months in space : hollow eyes , hollow cheeks , hollow stomach .","male","person","0.25","5","YES"
"[BRWN, PARA#3871, SENT#3]","It is like a mysterious epidemic which , starting first with Abigail and Parris , spreads inexorably with a dreadfully growing virulence through the whole town until all have been infected by it .","thing","epidemic","0.0","5","YES"
"[BRWN, PARA#6794, SENT#1]","The personal quality of Samuel Beckett is similar to qualities I had found in the plays .","","","0.0","0","YES"
"[BRWN, PARA#7424, SENT#1]","`` The Attorney General has been brooding over that evidence like an old hen on a doorknob for eighteen months '' , Hearst said .","person","hen","0.1","2","YES"
"[BRWN, PARA#14928, SENT#3]","The place was busy but I didn't feel like a Hun .","person","person","1.0","5","YES"
"[BRWN, PARA#8846, SENT#1]","Although the Af calculation is obvious by analogy with that for gravitational field and osmotic pressure , it is interesting to confirm it by a method which can be generalized to include related effects .","","","0.0","0","YES"
"[BRWN, PARA#1413, SENT#1]","`` It is like handing a loaded automatic to an 8-year-old and telling him to run out and play '' , he commented .","thing","hand","0.0","2","YES"
"[BRWN, PARA#10326, SENT#2]","She soared over the new pastor like an avenging angel lest he stray from the path and not know all the truth and gossip of which she was chief repository .","female","angel","0.06666666666666667","5","YES"
"[BRWN, PARA#7416, SENT#2]","We must avoid the notion , suggested to some people by examples such as those just mentioned , that ideas are `` units '' in some way comparable to coins or counters that can be passed intact from one group of people to another or even , for that matter , from one individual to another .","","","0.0","0","YES"
"[BRWN, PARA#4906, SENT#4]","Why did Prokofieff expand in stature and fecundity , while Stravinsky ( who leaped into fame like a young giant ) dwindled in stature and fruitfulness ? ?","person","giant","0.25","4","YES"
"[BRWN, PARA#14494, SENT#2]","We went into Mrs. Monmouth's library , which had low bookshelves all along the walls , and above them a Modigliani portrait , a Jackson Pollock twelve feet long , and a gorgeous Miro with a yellow background , that looked like an inscription from a Martian tomb .","thing","inscription","0.1111111111111111","5","YES"
"[BRWN, PARA#3538, SENT#1]","Miss Vaughan was back in top form , somehow mellowed and improved with the passage of time -- like a fine wine .","person","wine","0.14285714285714285","3","YES"
"[BRWN, PARA#14595, SENT#1]","But now with real anger at last , something proud and indignant , Early Spring stood like a she wolf before her den and cried , `` I will not shriek at you ! !","person","wolf","0.1","5","YES"
"[BRWN, PARA#15578, SENT#5]","The sound mockery of sheep is like the salubrious horse laugh '' .","mockery","laugh","0.125","5","YES"
"[BRWN, PARA#6921, SENT#2]","Here there may be an analogy with cancer : we can detect cancers by their rapidly accelerating growth , determinable only when related to the more normal rate of healthy growth .","","","0.0","0","YES"
"[BRWN, PARA#6769, SENT#1]","Our collective policies , group and national , are similarly based on voodoo , but here we often lack even the empirically successful rituals and are still engaged in determing them .","","","0.0","0","YES"
"[BRWN, PARA#8979, SENT#5]","The life history of the alkali bee is similar to that of Andrena , but the first activity of the adults does not take place until summer , and the individuals hibernate in the prepupal stage .","","","0.0","0","YES"
"[BRWN, PARA#14487, SENT#13]","You laughed and then your chest swelled and you felt you could cry for a little bit , and then a feeling hit you like a chill in your stomach and the goose bumps rippled along your arm .","feel","chill","0.1111111111111111","2","YES"
"[BRWN, PARA#3735, SENT#2]","In their very first speeches it was clear that Shakespeare , like a Nostradamus , had foreseen this moment .","person","person","1.0","5","YES"
"[BRWN, PARA#6531, SENT#2]","Mrs. Hosaka is one of the Japanese women one reads about -- beautiful , artistically talented , an artful manager of her big household -- ( four boys and four girls ) , and yet looking like a pampered , gentle Japanese woman .","","","0.0","0","NO"
"[BRWN, PARA#5227, SENT#3]","We have not yet succeeded in establishing recognition of technical specialization comparable to our higher levels of management , but I believe we will trend in this direction but not to exceed vice-president '' .","","","0.0","0","NO"
"[BRWN, PARA#15097, SENT#2]","She didn't sound like a pale girl .","female","girl","0.14285714285714285","5","NO"
"[BRWN, PARA#11885, SENT#3]","Bonner explained that , with the nightclub's cooperation , the police had occupied El Dorado like a battlefield .","police","battlefield","0.07142857142857142","2","NO"
"[BRWN, PARA#5684, SENT#2]","From where I sit it looks more like a nightmare .","thing","nightmare","0.14285714285714285","5","NO"
"[BRWN, PARA#6581, SENT#14]","( Whether historical nationalism helped the peoples of the remainder of the world , and whether today's nationalism in the former colonial areas has equally beneficial aspects , are other questions .","","","0.0","0","NO"
"[BRWN, PARA#3535, SENT#3]","He prefers to have his soloist performing and thus we get only brief glimpses of what his ensemble work is like .","people","glimpse","0.09090909090909091","2","NO"
"[BRWN, PARA#14211, SENT#2]","You could set up tables in the front room and serve salads and your baked beans and brown bread and Grandma could dress like a gypsy and tell fortunes '' .","person","gypsy","0.16666666666666666","2","NO"
"[BRWN, PARA#7828, SENT#5]","On matters of race he was similarly inflexible : `` Most of the modern Latin races seem to have inherited the rigidity of the Roman mind '' .","","","0.0","0","NO"
"[BRWN, PARA#6259, SENT#4]","The discovery during the Second World War that guar gum was similar to imported locust gum increased its cultivation in western Asia and initiated it in the United States .","","","0.0","0","NO"
"[BRWN, PARA#9336, SENT#1]","One hebephrenic woman often became submerged in what felt to me like a somehow phony experience of pseudo-emotion , during which , despite her wracking sobs and streaming cheeks , I felt only a cold annoyance with her .","submerge","experience","0.08333333333333333","4","NO"
"[BRWN, PARA#7841, SENT#3]","And his memory , like an elephant's , stored with precise knowledge of men and things and happenings '' .","memory","elephant","0.05263157894736842","5","NO"
"[BRWN, PARA#2110, SENT#3]","Chen was equally adamant in his opposition to the admission of Outer Mongolia ; ;","","","0.0","0","NO"
"[BRWN, PARA#4735, SENT#10]","It's good for cutting all the planking because it cuts with a bit-like blade at high rpm and does not chatter the plywood like a saber saw .","thing","saw","0.1","3","NO"
"[BRWN, PARA#8293, SENT#2]","Shipments of arms from Western countries could similarly be seized as contraband .","","","0.0","0","NO"
"[BRWN, PARA#3160, SENT#1]","To the average American , this must sound like an incredible tale from a Saturday night TV movie .","thing","tale","0.125","5","NO"
"[BRWN, PARA#10875, SENT#5]","Still he let Eileen treat him like a valet .","person","valet","0.2","2","NO"
"[BRWN, PARA#15465, SENT#3]","I fought like a tigress but by the time I appealed my case to the Supreme Court ( 1937 ) , Mr. Roosevelt and his `` henchmen '' had done their `` dirty work '' all too well , even going so far as to attempt to `` pack '' the highest tribunal in the land in order to defeat little me .","person","tigress","0.08333333333333333","5","NO"
"[BRWN, PARA#2262, SENT#1]","Either way it sounds like a sizable hunk of money and is .","thing","hunk","0.08333333333333333","5","NO"
"[BRWN, PARA#10730, SENT#2]","Joel worked like a field hand in the afternoons after school .","person","hand","0.1111111111111111","5","NO"
"[BRWN, PARA#9004, SENT#4]","The most distal airways are similar to those found in type 1 , , being composed of numerous , apparently true terminal bronchioles and occasional , poorly developed respiratory bronchioles ( figs. 14 , 15 ) .","","","0.0","0","NO"
"[BRWN, PARA#9872, SENT#10]","I am equally impatient with the shrug of the shoulder , shake of the head of those who no longer care because they have known it for so long ; ;","","","0.0","0","NO"
"[BRWN, PARA#3297, SENT#3]","Her debut over , perhaps the earlier scenes will emerge equally fine .","","","0.0","0","NO"
"[BRWN, PARA#777, SENT#1]","Shaw and Skorich headed a group of players , coaches and team officials who received an engrossed copy of an official city citation and a pair of silver cufflinks shaped like a football .","","","0.0","0","NO"
"[BRWN, PARA#12386, SENT#3]","It was like a recurrent , annoying dream , but now the dream was beginning to take on overtones of a nightmare .","thing","dream","0.08333333333333333","5","NO"
"[BRWN, PARA#5078, SENT#1]","It is like medical schools in India where , in that fairy-land of religious inhibition , the dissection of dead bodies is frowned upon .","thing","school","0.09090909090909091","5","NO"
"[BRWN, PARA#10013, SENT#3]","This was equivalent to 240 mg/lBOD on a 24-hr. basis .","","","0.0","0","NO"
"[BRWN, PARA#5349, SENT#4]","Rates for American cars are somewhat higher , ranging from about $8.00 a day up to $14.00 a day for a Chevrolet Convertible , but the rate per kilometer driven is roughly the same as for the larger European models .","","","0.0","0","NO"
"[BRWN, PARA#14571, SENT#2]","You look like a tweedy Englishman .","person","person","1.0","5","NO"
"[BRWN, PARA#9057, SENT#2]","As controls , other sections were similarly treated with Af or conjugated antiserum to the New York strain of potato yellow-dwarf virus ( Wolcyrz and Black , 1956 ) .","","","0.0","0","NO"
"[BRWN, PARA#8072, SENT#2]","The resulting setup , it was declared , `` would be similar to that which is in successful operation in a number of metropolitan counties as large or larger than Rhode Island '' .","","","0.0","0","NO"
"[BRWN, PARA#7742, SENT#2]","But when the situation was so complicated that even Nogaret , one of the principal actors in the drama , could misinterpret the pope's motives , it is possible that Othon and his companions , equally baffled , attributed their difficulties to a more immediate cause .","","","0.0","0","NO"
"[BRWN, PARA#6698, SENT#1]","Less dazzling than Hamilton , less eloquent than Jefferson , John Jay commands an equally high rank among the Founding Fathers .","","","0.0","0","NO"
"[BRWN, PARA#9952, SENT#4]","Nothing looks anything like an Ernst or an Arp but another Ernst or Arp .","person","person","1.0","5","NO"
"[BRWN, PARA#4220, SENT#3]","My message , today , is the same as it was 15 years ago : that there is goodness in people , and strength and love in God .","","","0.0","0","NO"
"[BRWN, PARA#5270, SENT#5]","the art of preprinting in distortion was similarly perfected by the sign makers ; ;","","","0.0","0","NO"
"[BRWN, PARA#436, SENT#1]","It is difficult to be certain how the administration views that $28 million , since the views of one leader may not be the same as the views of another one .","","","0.0","0","NO"
"[BRWN, PARA#14434, SENT#5]","Mr. Heiser , does this sound like a truly workable plan to you ? ?","","","0.0","0","NO"
"[BRWN, PARA#6908, SENT#1]","On the parade ground the net may be similar to that shown in Figure 3 .","","","0.0","0","NO"
"[BRWN, PARA#6687, SENT#2]","Incapable of self-delusion , the Founding Fathers found the crisis of their time to be equally grave , and yet they had confidence that America would surmount it and that a republic of free peoples would prosper and serve as an example to a world aching for liberty .","","","0.0","0","NO"
"[BRWN, PARA#10641, SENT#10]","`` Finally , all I needed was to throw a little piece of red wood that looked like a firecracker and that dumb dog would run ki-yi-ing for his life '' .","thing","firecracker","0.07142857142857142","5","NO"
"[BRWN, PARA#7353, SENT#1]","Every day , when the President took his nap , Rob Roy would stretch out on the window seat near him , like a perfect gentleman , and stare thoughtfully out the window , or he would take a little nap himself .","person","stretch","0.125","5","NO"
"[BRWN, PARA#9067, SENT#4]","In the direct method , Af , not further treated , stained certain tissues of healthy sweet clover stems nonspecifically and WTV tumor sections were similarly stained by comparable Af .","","","0.0","0","NO"
"[BRWN, PARA#9368, SENT#9]","when it represents only itself and on which is its complement ( so that go on is semantically equivalent to board ) , on has stronger stress than go does .","","","0.0","0","NO"
"[BRWN, PARA#13153, SENT#2]","`` Or maybe you just don't feel like a cigar '' ? ?","person","cigar","0.125","5","NO"
"[BRWN, PARA#9722, SENT#2]","Whatever the unhappy inmates of such camps are like today , Dostoevsky's companions were about as grim a lot as can be imagined .","companion","today","0.09090909090909091","5","NO"
"[BRWN, PARA#14586, SENT#4]","Devout , orthodox and plain like a family she might meet in Brooklyn or Malta or Ireland .","female","family","0.07142857142857142","5","NO"
"[BRWN, PARA#9056, SENT#3]","As controls other sections were similarly covered with Aj .","","","0.0","0","NO"
"[BRWN, PARA#11835, SENT#4]","He , of course , must have been equally unprepared for what confronted him , but , nonetheless , I did find his reaction startling .","","","0.0","0","NO"
"[BRWN, PARA#8870, SENT#2]","For the low-temperature measurements the sample was cooled by a cold nitrogen gas flow method similar to that of Andrew and Eades .","","","0.0","0","NO"
"[BRWN, PARA#12187, SENT#2]","a tension similar to the one now .","","","0.0","0","NO"
"[BRWN, PARA#6847, SENT#3]","These are like the initial ways in which the world forces itself upon the self and thrusts the self into decision and choice .","things","ways","0.08333333333333333","5","NO"
"[BRWN, PARA#9893, SENT#3]"," He finds it equally `` remarkable that their critical diagnosis and prognosis should have so much in common among themselves and with the critics of the twentieth century '' .","","","0.0","0","NO"
"[BRWN, PARA#11705, SENT#1]","It was a long , low room , like a root cellar , for it was banked up with soil , and vines had run rampant over that , too .","thing","cellar","0.07692307692307693","5","NO"
"[BRWN, PARA#3148, SENT#4]","and it is still very far from certain how valid the party's claim is that in `` a growing number of kolkhozes '' the peasants are finding it more profitable , to surrender their private plots to the kolkhoz and to let the latter be turned into something increasingly like a state farm .","latter","farm","0.06666666666666667","2","NO"
"[BRWN, PARA#9528, SENT#3]","If this seems arbitrary , its effect was to treat citizens of the District of Columbia equally with citizens of the states -- at the expense of expanding a troublesome jurisdiction .","","","0.0","0","NO"
"[BRWN, PARA#9408, SENT#3]","An attempted middle course might lead to devices like a 5000-word alphabetized dictionary from which every fiftieth word was selected .","course","person","0.09090909090909091","5","NO"
"[BRWN, PARA#7747, SENT#2]","Underneath all the high-sounding phrases of royal and papal letters and behind the more down-to-earth instructions to the envoys was the inescapable fact that Edward would have to desert his Flemish allies and leave them to the vengeance of their indignant suzerain , the king of France , in return for being given an equally free hand with the insubordinate Scots .","","","0.0","0","NO"
"[BRWN, PARA#4356, SENT#1]","Command's new Brahms Second is a major effort to make a record that sounds like a real orchestra rather than a copy of one .","thing","orchestra","0.1","5","NO"
"[BRWN, PARA#15211, SENT#1]","In Tokyo Richard took up a life similar to that which he had lived in New York , except that he had replaced his biwa with a friend .","","","0.0","0","NO"
"[BRWN, PARA#7911, SENT#1]","An equally promising avenue toward Atlantic community may lie through the development and expansion of the O.E.C.D. .","","","0.0","0","NO"
"[BRWN, PARA#11922, SENT#2]","`` You sound like an old woman .","person","woman","0.3333333333333333","5","NO"
"[BRWN, PARA#9011, SENT#5]","Finally , it is suggested that in many respects the horse lung may be anatomically more comparable to that of the human than any other presently known species .","","","0.0","0","NO"
"[BRWN, PARA#12228, SENT#2]","Although Bob dressed like a slob , he kept a neat office .","person","slob","0.2","2","NO"
"[BRWN, PARA#6645, SENT#7]","From upstream it looks like a long arcaded box laid across the river ; ;","thing","box","0.07692307692307693","2","NO"
"[BRWN, PARA#7249, SENT#2]","In spite of Pickering Dodge's explicit instructions regarding variation of meals , the food did not seem the same as at home .","","","0.0","0","NO"
"[BRWN, PARA#2116, SENT#3]","`` The old man came from the front of the plane and said he wanted four volunteers to go to Cuba '' , McCauley said , `` and like a nut I raised my hand .","person","nut","0.09090909090909091","2","NO"
"[BRWN, PARA#15068, SENT#1]","This vacation had seemed like a good idea last week , when his doctor had prescribed it .","vacation","idea","0.09090909090909091","5","NO"
"[BRWN, PARA#11697, SENT#4]","Rev loved Honotassa , it was like a part of his breath and body ; ;","thing","part","0.14285714285714285","5","NO"
"[BRWN, PARA#11420, SENT#2]","Kinda like a zombie ? ?","","","0.0","0","NO"
"[BRWN, PARA#8566, SENT#14]","The interest rate will be similar to those prevailing in India on comparable loans and the maturities will be consistent with the purposes of the financing .","","","0.0","0","NO"
"[BRWN, PARA#14440, SENT#8]","And Alexander sobbed like a girl for the dreams he had had , and he felt no shame .","male","girl","0.14285714285714285","2","NO"
"[BRWN, PARA#7734, SENT#5]","The mild activity of his command during the sojourn of the troops at Valley Forge could be handled by a subordinate , he felt , so like Henry Knox , equally loyal to Washington , who went to Boston at this time , Morgan received permission to visit his home in Virginia for several weeks .","person","person","1.0","2","NO"
"[BRWN, PARA#13904, SENT#3]","Even now , like a ringing in his ears , he heard the wooooosh of flame-throwers squirting great orange billows .","","","0.0","0","NO"
"[BRWN, PARA#11230, SENT#3]","Then he looked at his finger , at the wrinkled , heavy knuckle and the thick nail he used like a knife to pry up , slit , and open .","male","knife","0.07692307692307693","5","NO"
"[BRWN, PARA#8847, SENT#3]","This has an interesting analogy with the assumption stated by Philippoff that `` the deformational mechanics of elastic solids can be applied to flowing solutions '' .","","","0.0","0","NO"
"[BRWN, PARA#11226, SENT#7]","`` This coat looks like a rag heap '' .","coat","heap","0.07142857142857142","5","NO"
"[BRWN, PARA#14692, SENT#1]","Susan looked like an overwhelmed baby nurse ; ;","person","nurse","0.2","5","NO"
"[BRWN, PARA#7713, SENT#1]","Students are approximately equally divided between those who regard vocational preparation as the primary goal of an ideal education and those who chose a general liberal education .","","","0.0","0","NO"
"[BRWN, PARA#8117, SENT#1]","In sixteen states , the fiscal year ending of the cities ( June 30 ) is the same as that of the state : Alaska , Arizona , California , Delaware , Massachusetts , Montana , Nevada , New Mexico , North Carolina , North Dakota , Oklahoma , Oregon , Vermont , West Virginia , Wyoming , and Hawaii ) .","","","0.0","0","NO"
"[BRWN, PARA#7556, SENT#2]","Repnin , who had a rather narrow face , longish nose , high forehead , and arching brows , looked like a quizzical Mephistopheles .","person","person","1.0","5","NO"
"[BRWN, PARA#7825, SENT#2]","Much criticism has been leveled at this rather forced analogy , but what is equally significant is Adams' complete acceptance of the Biblical record as `` good and trustworthy history '' .","","","0.0","0","NO"
"[BRWN, PARA#13720, SENT#2]","The Bonaventure was quivering and lurching like an old spavined mare .","person","mare","0.08333333333333333","5","NO"
"[BRWN, PARA#1938, SENT#2]","In Laos , the picture was almost equally bad .","","","0.0","0","NO"
"[BRWN, PARA#7565, SENT#1]","Alexander Vasilievitch Suvorov , now in his fifty-ninth year ( ten years Potemkin's senior ) , was a thin , worn-faced person of less than medium height who looked like a professor of botany .","person","professor","0.16666666666666666","4","NO"
"[BRWN, PARA#8921, SENT#10]","Also , it has been suggested that the source of all or part of the dust may not be the same as that for visual or radar meteorites ( Best , 1960 ) , and the same distribution would not be expected .","","","0.0","0","NO"
"[BRWN, PARA#12439, SENT#2]","there was much to grok , loose ends to puzzle over and fit into his growing -- all that he had seen and heard and been at the Archangel Foster Tabernacle ( not just cusp when he and Digby had come face to face alone ) why Bishop Senator Boone made him warily uneasy , how Miss Dawn Ardent tasted like a water brother when she was not , the smell of goodness he had incompletely grokked in the jumping up and down and wailing --","person","brother","0.2","2","NO"
"[BRWN, PARA#8704, SENT#2]","The building will contain 430,000 square feet , approximately the same as our present plant .","","","0.0","0","NO"
"[BRWN, PARA#11566, SENT#1]","Then he heard it , like a muffled thud , felt a subtle change in air pressure .","thing","thud","0.1","2","NO"
"[BRWN, PARA#7317, SENT#2]","Indeed , he looked more like a well-fleshed lay brother of the Hospice of St. Bernard .","male","brother","0.125","5","NO"
