"[BRWN, PARA#13855, SENT#3]", Rumors in a battle spread like a grassfire .,1,1,1,
"[BRWN, PARA#13855, SENT#3]", The artist is like a fragment of a mosaic .,1,1,1,
"[BRWN, PARA#13855, SENT#3]", She stood up and grasped the chair arms and brought her thin body upright like a bird alert for flight.,1,1,1,
"[BRWN, PARA#13782, SENT#3]",It made only a tiny bump over the two men like a tire over a piece of gravel then moved on .,1,1,1,
"[BRWN, PARA#14854, SENT#3]",But Chris brightened up like a candle .,1,1,1,
"[BRWN, PARA#14613, SENT#2]","He shouted like a hoarse old mastiff , his hair stiff and bristling .",1,1,1,
