"name","text"
"[10, PARA#19340, SENT#1]","24 : 32 Now learn a parable of the fig tree ; When his branch is yet tender , and putteth forth leaves , ye know that summer is nigh : 24 : 33 So likewise ye , when ye shall see all these things , know that it is near , even at the doors ."
"[10, PARA#19369, SENT#1]","25 : 17 And likewise he that had received two , he also gained other two ."
"[10, PARA#19604, SENT#1]","4 : 16 And these are they likewise which are sown on stony ground ; who , when they have heard the word , immediately receive it with gladness ; 4 : 17 And have no root in themselves , and so endure but for a time : afterward , when affliction or persecution ariseth for the word ' s sake , immediately they are offended ."
"[10, PARA#19880, SENT#1]","12 : 21 And the second took her , and died , neither left he any seed : and the third likewise ."
"[10, PARA#20119, SENT#1]","2 : 38 And she coming in that instant gave thanks likewise unto the Lord , and spake of him to all them that looked for redemption in Jerusalem ."
"[10, PARA#20138, SENT#2]","3 : 11 He answereth and saith unto them , He that hath two coats , let him impart to him that hath none ; and he that hath meat , let him do likewise ."
"[10, PARA#20140, SENT#1]","3 : 14 And the soldiers likewise demanded of him , saying , And what shall we do ?"
"[10, PARA#20208, SENT#1]","5 : 33 And they said unto him , Why do the disciples of John fast often , and make prayers , and likewise the disciples of the Pharisees ; but thine eat and drink ?"
"[10, PARA#20234, SENT#1]","6 : 31 And as ye would that men should do to you , do ye also to them likewise ."
"[10, PARA#20416, SENT#1]","10 : 32 And likewise a Levite , when he was at the place , came and looked on him , and passed by on the other side ."
"[10, PARA#20419, SENT#3]","Then said Jesus unto him , Go , and do thou likewise ."
"[10, PARA#20508, SENT#2]","13 : 3 I tell you , Nay : but , except ye repent , ye shall all likewise perish ."
"[10, PARA#20509, SENT#2]","13 : 5 I tell you , Nay : but , except ye repent , ye shall all likewise perish ."
"[10, PARA#20553, SENT#1]","14 : 33 So likewise , whosoever he be of you that forsaketh not all that he hath , he cannot be my disciple ."
"[10, PARA#20559, SENT#1]","15 : 7 I say unto you , that likewise joy shall be in heaven over one sinner that repenteth , more than over ninety and nine just persons , which need no repentance ."
"[10, PARA#20596, SENT#1]","16 : 25 But Abraham said , Son , remember that thou in thy lifetime receivedst thy good things , and likewise Lazarus evil things : but now he is comforted , and thou art tormented ."
"[10, PARA#20608, SENT#1]","17 : 10 So likewise ye , when ye shall have done all those things which are commanded you , say , We are unprofitable servants : we have done that which was our duty to do ."
"[10, PARA#20624, SENT#1]","17 : 31 In that day , he which shall be upon the housetop , and his stuff in the house , let him not come down to take it away : and he that is in the field , let him likewise not return back ."
"[10, PARA#20679, SENT#1]","19 : 19 And he said likewise to him , Be thou also over five cities ."
"[10, PARA#20750, SENT#1]","21 : 31 So likewise ye , when ye see these things come to pass , know ye that the kingdom of God is nigh at hand ."
"[10, PARA#20786, SENT#1]","22 : 36 Then said he unto them , But now , he that hath a purse , let him take it , and likewise his scrip : and he that hath no sword , let him sell his garment , and buy one ."
"[10, PARA#21046, SENT#1]","5 : 19 Then answered Jesus and said unto them , Verily , verily , I say unto you , The Son can do nothing of himself , but what he seeth the Father do : for what things soever he doeth , these also doeth the Son likewise ."
"[10, PARA#21079, SENT#1]","6 : 11 And Jesus took the loaves ; and when he had given thanks , he distributed to the disciples , and the disciples to them that were set down ; and likewise of the fishes as much as they would ."
"[10, PARA#21602, SENT#1]","21 : 13 Jesus then cometh , and taketh bread , and giveth them , and fish likewise ."
"[10, PARA#21676, SENT#1]","3 : 24 Yea , and all the prophets from Samuel and those that follow after , as many as have spoken , have likewise foretold of these days ."
"[10, PARA#22394, SENT#1]","1 : 26 For this cause God gave them up unto vile affections : for even their women did change the natural use into that which is against nature : 1 : 27 And likewise also the men , leaving the natural use of the woman , burned in their lust one toward another ; men with men working that which is unseemly , and receiving in themselves that recompence of their error which was meet ."
"[10, PARA#22759, SENT#1]","7 : 3 Let the husband render unto the wife due benevolence : and likewise also the wife unto the husband ."
"[10, PARA#22760, SENT#1]","7 : 4 The wife hath not power of her own body , but the husband : and likewise also the husband hath not power of his own body , but the wife ."
"[10, PARA#22776, SENT#1]","7 : 22 For he that is called in the Lord , being a servant , is the Lord ' s freeman : likewise also he that is called , being free , is Christ ' s servant ."
"[10, PARA#22904, SENT#4]","14 : 9 So likewise ye , except ye utter by the tongue words easy to be understood , how shall it be known what is spoken ?"
"[10, PARA#23201, SENT#1]","2 : 13 And the other Jews dissembled likewise with him ; insomuch that Barnabas also was carried away with their dissimulation ."
"[10, PARA#23484, SENT#1]","4 : 16 And when this epistle is read among you , cause that it be read also in the church of the Laodiceans ; and that ye likewise read the epistle from Laodicea ."
"[10, PARA#23728, SENT#1]","2 : 3 The aged women likewise , that they be in behaviour as becometh holiness , not false accusers , not given to much wine , teachers of good things ; 2 : 4 That they may teach the young women to be sober , to love their husbands , to love their children , 2 : 5 To be discreet , chaste , keepers at home , good , obedient to their own husbands , that the word of God be not blasphemed ."
"[10, PARA#23729, SENT#1]","2 : 6 Young men likewise exhort to be sober minded ."
"[10, PARA#23772, SENT#1]","2 : 14 Forasmuch then as the children are partakers of flesh and blood , he also himself likewise took part of the same ; that through death he might destroy him that had the power of death , that is , the devil ; 2 : 15 And deliver them who through fear of death were all their lifetime subject to bondage ."
"[10, PARA#24078, SENT#1]","4 : 1 Forasmuch then as Christ hath suffered for us in the flesh , arm yourselves likewise with the same mind : for he that hath suffered in the flesh hath ceased from sin ; 4 : 2 That he no longer should live the rest of his time in the flesh to the lusts of men , but to the will of God ."
"[10, PARA#24387, SENT#1]","8 : 12 And the fourth angel sounded , and the third part of the sun was smitten , and the third part of the moon , and the third part of the stars ; so as the third part of them was darkened , and the day shone not for a third part of it , and the night likewise ."
"[10, PARA#16481, SENT#1]","4 : 2 The precious sons of Zion , comparable to fine gold , how are they esteemed as earthen pitchers , the work of the hands of the potter !"
"[10, PARA#17376, SENT#1]","42 : 11 And the way before them was like the appearance of the chambers which were toward the north , as long as they , and as broad as they : and all their goings out were both according to their fashions , and according to their doors ."
"[10, PARA#1609, SENT#1]","16 : 31 And the house of Israel called the name thereof Manna : and it was like coriander seed , white ; and the taste of it was like wafers made with honey ."
"[10, PARA#1794, SENT#1]","24 : 17 And the sight of the glory of the LORD was like devouring fire on the top of the mount in the eyes of the children of Israel ."
"[10, PARA#5208, SENT#1]","13 : 6 Then the woman came and told her husband , saying , A man of God came unto me , and his countenance was like the countenance of an angel of God , very terrible : but I asked him not whence he was , neither told he me his name : 13 : 7 But he said unto me , Behold , thou shalt conceive , and bear a son ; and now drink no wine nor strong drink , neither eat any unclean thing : for the child shall be a Nazarite to God from the womb to the day of his death ."
"[10, PARA#6983, SENT#1]","7 : 33 And the work of the wheels was like the work of a chariot wheel : their axletrees , and their naves , and their felloes , and their spokes , were all molten ."
"[10, PARA#16525, SENT#1]","1 : 7 And their feet were straight feet ; and the sole of their feet was like the sole of a calf ' s foot : and they sparkled like the colour of burnished brass ."
"[10, PARA#16531, SENT#1]","1 : 13 As for the likeness of the living creatures , their appearance was like burning coals of fire , and like the appearance of lamps : it went up and down among the living creatures ; and the fire was bright , and out of the fire went forth lightning ."
"[10, PARA#16534, SENT#1]","1 : 16 The appearance of the wheels and their work was like unto the colour of a beryl : and they four had one likeness : and their appearance and their work was as it were a wheel in the middle of a wheel ."
"[10, PARA#17116, SENT#1]","31 : 8 The cedars in the garden of God could not hide him : the fir trees were not like his boughs , and the chestnut trees were not like his branches ; nor any tree in the garden of God was like unto him in his beauty ."
"[10, PARA#17299, SENT#1]","40 : 3 And he brought me thither , and , behold , there was a man , whose appearance was like the appearance of brass , with a line of flax in his hand , and a measuring reed ; and he stood in the gate ."
"[10, PARA#17710, SENT#1]","7 : 9 I beheld till the thrones were cast down , and the Ancient of days did sit , whose garment was white as snow , and the hair of his head like the pure wool : his throne was like the fiery flame , and his wheels as burning fire ."
"[10, PARA#17778, SENT#1]","10 : 4 And in the four and twentieth day of the first month , as I was by the side of the great river , which is Hiddekel ; 10 : 5 Then I lifted up mine eyes , and looked , and behold a certain man clothed in linen , whose loins were girded with fine gold of Uphaz : 10 : 6 His body also was like the beryl , and his face as the appearance of lightning , and his eyes as lamps of fire , and his arms and his feet like in colour to polished brass , and the voice of his words like the voice of a multitude ."
"[10, PARA#18104, SENT#1]","2 : 9 Yet destroyed I the Amorite before them , whose height was like the height of the cedars , and he was strong as the oaks ; yet I destroyed his fruit from above , and his roots from beneath ."
"[10, PARA#18214, SENT#1]","1 : 4 But the LORD sent out a great wind into the sea , and there was a mighty tempest in the sea , so that the ship was like to be broken ."
"[10, PARA#19497, SENT#1]","28 : 3 His countenance was like lightning , and his raiment white as snow : 28 : 4 And for fear of him the keepers did shake , and became as dead men ."
"[10, PARA#24448, SENT#1]","13 : 2 And the beast which I saw was like unto a leopard , and his feet were as the feet of a bear , and his mouth as the mouth of a lion : and the dragon gave him his power , and his seat , and great authority ."
