"name","text"
"[10, PARA#1570, SENT#1]","15 : 11 Who is like unto thee , O LORD , among the gods ?"
"[10, PARA#4429, SENT#1]","33 : 17 His glory is like the firstling of his bullock , and his horns are like the horns of unicorns : with them he shall push the people together to the ends of the earth : and they are the ten thousands of Ephraim , and they are the thousands of Manasseh ."
"[10, PARA#4441, SENT#1]","33 : 29 Happy art thou , O Israel : who is like unto thee , O people saved by the LORD , the shield of thy help , and who is the sword of thy excellency !"
"[10, PARA#6115, SENT#4]","and who is like to thee in Israel ?"
"[10, PARA#6348, SENT#1]","7 : 23 And what one nation in the earth is like thy people , even like Israel , whom God went to redeem for a people to himself , and to make him a name , and to do for you great things and terrible , for thy land , before thy people , which thou redeemedst to thee from Egypt , from the nations and their gods ?"
"[10, PARA#6612, SENT#1]","18 : 27 And the watchman said , Me thinketh the running of the foremost is like the running of Ahimaaz the son of Zadok ."
"[10, PARA#7655, SENT#1]","9 : 20 And the watchman told , saying , He came even unto them , and cometh not again : and the driving is like the driving of Jehu the son of Nimshi ; for he driveth furiously ."
"[10, PARA#8474, SENT#1]","17 : 21 And what one nation in the earth is like thy people Israel , whom God went to redeem to be his own people , to make thee a name of greatness and terribleness , by driving out nations from before thy people whom thou hast redeemed out of Egypt ?"
"[10, PARA#10587, SENT#1]","34 : 7 What man is like Job , who drinketh up scorning like water ?"
"[10, PARA#11027, SENT#1]","22 : 14 I am poured out like water , and all my bones are out of joint : my heart is like wax ; it is melted in the midst of my bowels ."
"[10, PARA#11230, SENT#1]","35 : 10 All my bones shall say , LORD , who is like unto thee , which deliverest the poor from him that is too strong for him , yea , the poor and the needy from him that spoileth him ?"
"[10, PARA#11254, SENT#1]","36 : 6 Thy righteousness is like the great mountains ; thy judgments are a great deep : O LORD , thou preservest man and beast ."
"[10, PARA#11472, SENT#1]","49 : 12 Nevertheless man being in honour abideth not : he is like the beasts that perish ."
"[10, PARA#11480, SENT#1]","49 : 20 Man that is in honour , and understandeth not , is like the beasts that perish ."
"[10, PARA#11596, SENT#1]","58 : 4 Their poison is like the poison of a serpent : they are like the deaf adder that stoppeth her ear ;"
"[10, PARA#11808, SENT#1]","71 : 19 Thy righteousness also , O God , is very high , who hast done great things : O God , who is like unto thee !"
"[10, PARA#12633, SENT#1]","113 : 5 Who is like unto the LORD our God , who dwelleth on high ,"
"[10, PARA#12987, SENT#1]","133 : 2 It is like the precious ointment upon the head , that ran down upon the beard , even Aaron ' s beard : that went down to the skirts of his garments ;"
"[10, PARA#13127, SENT#1]","144 : 4 Man is like to vanity : his days are as a shadow that passeth away ."
"[10, PARA#13693, SENT#1]","20 : 5 Counsel in the heart of man is like deep water ; but a man of understanding will draw it out ."
"[10, PARA#13830, SENT#1]","25 : 11 A word fitly spoken is like apples of gold in pictures of silver ."
"[10, PARA#13833, SENT#1]","25 : 14 Whoso boasteth himself of a false gift is like clouds and wind without rain ."
"[10, PARA#13838, SENT#1]","25 : 19 Confidence in an unfaithful man in time of trouble is like a broken tooth , and a foot out of joint ."
"[10, PARA#13846, SENT#1]","25 : 28 He that hath no rule over his own spirit is like a city that is broken down , and without walls ."
"[10, PARA#13863, SENT#1]","26 : 17 He that passeth by , and meddleth with strife belonging not to him , is like one that taketh a dog by the ears ."
"[10, PARA#13899, SENT#1]","28 : 3 A poor man that oppresseth the poor is like a sweeping rain which leaveth no food ."
"[10, PARA#13982, SENT#1]","31 : 14 She is like the merchants ' ships ; she bringeth her food from afar ."
"[10, PARA#14201, SENT#1]","2 : 9 My beloved is like a roe or a young hart : behold , he standeth behind our wall , he looketh forth at the windows , shewing himself through the lattice ."
"[10, PARA#14220, SENT#1]","4 : 4 Thy neck is like the tower of David builded for an armoury , whereon there hang a thousand bucklers , all shields of mighty men ."
"[10, PARA#14226, SENT#4]","4 : 11 Thy lips , O my spouse , drop as the honeycomb : honey and milk are under thy tongue ; and the smell of thy garments is like the smell of Lebanon ."
"[10, PARA#14257, SENT#1]","7 : 2 Thy navel is like a round goblet , which wanteth not liquor : thy belly is like an heap of wheat set about with lilies ."
"[10, PARA#14260, SENT#1]","7 : 5 Thine head upon thee is like Carmel , and the hair of thine head like purple ; the king is held in the galleries ."
"[10, PARA#14261, SENT#2]","7 : 7 This thy stature is like to a palm tree , and thy breasts to clusters of grapes ."
"[10, PARA#14794, SENT#1]","33 : 9 The earth mourneth and languisheth : Lebanon is ashamed and hewn down : Sharon is like a wilderness ; and Bashan and Carmel shake off their fruits ."
"[10, PARA#15887, SENT#4]","for that day is great , so that none is like it : it is even the time of Jacob ' s trouble , but he shall be saved out of it ."
"[10, PARA#16053, SENT#1]","38 : 7 Now when Ebedmelech the Ethiopian , one of the eunuchs which was in the king ' s house , heard that they had put Jeremiah in the dungeon ; the king then sitting in the gate of Benjamin ; 38 : 8 Ebedmelech went forth out of the king ' s house , and spake to the king saying , 38 : 9 My lord the king , these men have done evil in all that they have done to Jeremiah the prophet , whom they have cast into the dungeon ; and he is like to die for hunger in the place where he is : for there is no more bread in the city ."
"[10, PARA#16171, SENT#1]","46 : 20 Egypt is like a very fair heifer , but destruction cometh ; it cometh out of the north ."
"[10, PARA#16239, SENT#1]","49 : 19 Behold , he shall come up like a lion from the swelling of Jordan against the habitation of the strong : but I will suddenly make him run away from her : and who is a chosen man , that I may appoint over her ?"
"[10, PARA#16297, SENT#1]","50 : 44 Behold , he shall come up like a lion from the swelling of Jordan unto the habitation of the strong : but I will make them suddenly run away from her : and who is a chosen man , that I may appoint over her ?"
"[10, PARA#16326, SENT#1]","51 : 33 For thus saith the LORD of hosts , the God of Israel ; The daughter of Babylon is like a threshingfloor , it is time to thresh her : yet a little while , and the time of her harvest shall come ."
"[10, PARA#16852, SENT#1]","19 : 10 Thy mother is like a vine in thy blood , planted by the waters : she was fruitful and full of branches by reason of many waters ."
"[10, PARA#16956, SENT#1]","23 : 20 For she doted upon their paramours , whose flesh is as the flesh of asses , and whose issue is like the issue of horses ."
"[10, PARA#17003, SENT#1]","25 : 8 Thus saith the Lord GOD ; Because that Moab and Seir do say , Behold , the house of Judah is like unto all the heathen ; 25 : 9 Therefore , behold , I will open the side of Moab from the cities , from his cities which are on his frontiers , the glory of the country , Bethjeshimoth , Baalmeon , and Kiriathaim , 25 : 10 Unto the men of the east with the Ammonites , and will give them in possession , that the Ammonites may not be remembered among the nations ."
"[10, PARA#17051, SENT#1]","27 : 32 And in their wailing they shall take up a lamentation for thee , and lament over thee , saying , What city is like Tyrus , like the destroyed in the midst of the sea ?"
"[10, PARA#17623, SENT#1]","3 : 25 He answered and said , Lo , I see four men loose , walking in the midst of the fire , and they have no hurt ; and the form of the fourth is like the Son of God ."
"[10, PARA#17940, SENT#1]","7 : 11 Ephraim also is like a silly dove without heart : they call to Egypt , they go to Assyria ."
"[10, PARA#18705, SENT#3]","for he is like a refiner ' s fire , and like fullers ' soap : 3 : 3 And he shall sit as a refiner and purifier of silver : and he shall purify the sons of Levi , and purge them as gold and silver , that they may offer unto the LORD an offering in righteousness ."
"[10, PARA#18965, SENT#2]","It is like unto children sitting in the markets , and calling unto their fellows , 11 : 17 And saying , We have piped unto you , and ye have not danced ; we have mourned unto you , and ye have not lamented ."
"[10, PARA#19034, SENT#1]","13 : 31 Another parable put he forth unto them , saying , The kingdom of heaven is like to a grain of mustard seed , which a man took , and sowed in his field : 13 : 32 Which indeed is the least of all seeds : but when it is grown , it is the greatest among herbs , and becometh a tree , so that the birds of the air come and lodge in the branches thereof ."
"[10, PARA#19035, SENT#1]","13 : 33 Another parable spake he unto them ; The kingdom of heaven is like unto leaven , which a woman took , and hid in three measures of meal , till the whole was leavened ."
"[10, PARA#19042, SENT#1]","13 : 44 Again , the kingdom of heaven is like unto treasure hid in a field ; the which when a man hath found , he hideth , and for joy thereof goeth and selleth all that he hath , and buyeth that field ."
"[10, PARA#19043, SENT#1]","13 : 45 Again , the kingdom of heaven is like unto a merchant man , seeking goodly pearls : 13 : 46 Who , when he had found one pearl of great price , went and sold all that he had , and bought it ."
"[10, PARA#19044, SENT#1]","13 : 47 Again , the kingdom of heaven is like unto a net , that was cast into the sea , and gathered of every kind : 13 : 48 Which , when it was full , they drew to shore , and sat down , and gathered the good into vessels , but cast the bad away ."
"[10, PARA#19047, SENT#1]","13 : 52 Then said he unto them , Therefore every scribe which is instructed unto the kingdom of heaven is like unto a man that is an householder , which bringeth forth out of his treasure things new and old ."
"[10, PARA#19201, SENT#1]","20 : 1 For the kingdom of heaven is like unto a man that is an householder , which went out early in the morning to hire labourers into his vineyard ."
"[10, PARA#19258, SENT#1]","22 : 1 And Jesus answered and spake unto them again by parables , and said , 22 : 2 The kingdom of heaven is like unto a certain king , which made a marriage for his son , 22 : 3 And sent forth his servants to call them that were bidden to the wedding : and they would not come ."
"[10, PARA#19284, SENT#1]","22 : 39 And the second is like unto it , Thou shalt love thy neighbour as thyself ."
"[10, PARA#19614, SENT#3]","4 : 31 It is like a grain of mustard seed , which , when it is sown in the earth , is less than all the seeds that be in the earth : 4 : 32 But when it is sown , it groweth up , and becometh greater than all herbs , and shooteth out great branches ; so that the fowls of the air may lodge under the shadow of it ."
"[10, PARA#19886, SENT#1]","12 : 31 And the second is like , namely this , Thou shalt love thy neighbour as thyself ."
"[10, PARA#20246, SENT#2]","6 : 47 Whosoever cometh to me , and heareth my sayings , and doeth them , I will shew you to whom he is like : 6 : 48 He is like a man which built an house , and digged deep , and laid the foundation on a rock : and when the flood arose , the stream beat vehemently upon that house , and could not shake it : for it was founded upon a rock ."
"[10, PARA#20247, SENT#1]","6 : 49 But he that heareth , and doeth not , is like a man that without a foundation built an house upon the earth ; against which the stream did beat vehemently , and immediately it fell ; and the ruin of that house was great ."
"[10, PARA#20518, SENT#3]","13 : 19 It is like a grain of mustard seed , which a man took , and cast into his garden ; and it grew , and waxed a great tree ; and the fowls of the air lodged in the branches of it ."
"[10, PARA#20519, SENT#2]","13 : 21 It is like leaven , which a woman took and hid in three measures of meal , till the whole was leavened ."
"[10, PARA#21218, SENT#2]","9 : 9 Some said , This is he : others said , He is like him : but he said , I am he ."
"[10, PARA#22076, SENT#1]","17 : 29 Forasmuch then as we are the offspring of God , we ought not to think that the Godhead is like unto gold , or silver , or stone , graven by art and man ' s device ."
"[10, PARA#23965, SENT#2]","For he that wavereth is like a wave of the sea driven with the wind and tossed ."
"[10, PARA#23979, SENT#1]","1 : 23 For if any be a hearer of the word , and not a doer , he is like unto a man beholding his natural face in a glass : 1 : 24 For he beholdeth himself , and goeth his way , and straightway forgetteth what manner of man he was ."
"[10, PARA#24450, SENT#1]","13 : 4 And they worshipped the dragon which gave power unto the beast : and they worshipped the beast , saying , Who is like unto the beast ?"
"[10, PARA#24532, SENT#3]","And every shipmaster , and all the company in ships , and sailors , and as many as trade by sea , stood afar off , 18 : 18 And cried when they saw the smoke of her burning , saying , What city is like unto this great city !"
"[10, PARA#10211, SENT#3]","13 : 12 Your remembrances are like unto ashes , your bodies to bodies of clay ."
"[10, PARA#10699, SENT#1]","40 : 18 His bones are as strong pieces of brass ; his bones are like bars of iron ."
"[10, PARA#10713, SENT#1]","41 : 18 By his neesings a light doth shine , and his eyes are like the eyelids of the morning ."
"[10, PARA#10750, SENT#1]","1 : 4 The ungodly are not so : but are like the chaff which the wind driveth away ."
"[10, PARA#12198, SENT#1]","90 : 5 Thou carriest them away as with a flood ; they are as a sleep : in the morning they are like grass which groweth up ."
"[10, PARA#12347, SENT#1]","102 : 11 My days are like a shadow that declineth ; and I am withered like grass ."
"[10, PARA#12653, SENT#1]","115 : 8 They that make them are like unto them ; so is every one that trusteth in them ."
"[10, PARA#13009, SENT#1]","135 : 18 They that make them are like unto them : so is every one that trusteth in them ."
"[10, PARA#13654, SENT#1]","18 : 19 A brother offended is harder to be won than a strong city : and their contentions are like the bars of a castle ."
"[10, PARA#13867, SENT#1]","26 : 23 Burning lips and a wicked heart are like a potsherd covered with silver dross ."
"[10, PARA#14218, SENT#1]","4 : 2 Thy teeth are like a flock of sheep that are even shorn , which came up from the washing ; whereof every one bear twins , and none is barren among them ."
"[10, PARA#14219, SENT#1]","4 : 3 Thy lips are like a thread of scarlet , and thy speech is comely : thy temples are like a piece of a pomegranate within thy locks ."
"[10, PARA#14221, SENT#1]","4 : 5 Thy two breasts are like two young roes that are twins , which feed among the lilies ."
"[10, PARA#14256, SENT#2]","the joints of thy thighs are like jewels , the work of the hands of a cunning workman ."
"[10, PARA#14258, SENT#1]","7 : 3 Thy two breasts are like two young roes that are twins ."
"[10, PARA#15199, SENT#1]","57 : 20 But the wicked are like the troubled sea , when it cannot rest , whose waters cast up mire and dirt ."
"[10, PARA#16737, SENT#2]","13 : 4 O Israel , thy prophets are like the foxes in the deserts ."
"[10, PARA#16938, SENT#1]","22 : 27 Her princes in the midst thereof are like wolves ravening the prey , to shed blood , and to destroy souls , to get dishonest gain ."
"[10, PARA#17945, SENT#1]","7 : 16 They return , but not to the most High : they are like a deceitful bow : their princes shall fall by the sword for the rage of their tongue : this shall be their derision in the land of Egypt ."
"[10, PARA#19307, SENT#2]","for ye are like unto whited sepulchres , which indeed appear beautiful outward , but are within full of dead men ' s bones , and of all uncleanness ."
"[10, PARA#20274, SENT#3]","7 : 32 They are like unto children sitting in the marketplace , and calling one to another , and saying , We have piped unto you , and ye have not danced ; we have mourned to you , and ye have not wept ."
"[10, PARA#24305, SENT#1]","2 : 18 And unto the angel of the church in Thyatira write ; These things saith the Son of God , who hath his eyes like unto a flame of fire , and his feet are like fine brass ; 2 : 19 I know thy works , and charity , and service , and faith , and thy patience , and thy works ; and the last to be more than the first ."
"[10, PARA#5272, SENT#3]","And he brake them from off his arms like a thread ."
"[10, PARA#5862, SENT#1]","17 : 7 And the staff of his spear was like a weaver ' s beam ; and his spear ' s head weighed six hundred shekels of iron : and one bearing a shield went before him ."
"[10, PARA#6682, SENT#1]","21 : 19 And there was again a battle in Gob with the Philistines , where Elhanan the son of Jaareoregim , a Bethlehemite , slew the brother of Goliath the Gittite , the staff of whose spear was like a weaver ' s beam ."
"[10, PARA#7304, SENT#1]","18 : 44 And it came to pass at the seventh time , that he said , Behold , there ariseth a little cloud out of the sea , like a man ' s hand ."
"[10, PARA#8351, SENT#1]","11 : 23 And he slew an Egyptian , a man of great stature , five cubits high ; and in the Egyptian ' s hand was a spear like a weaver ' s beam ; and he went down to him with a staff , and plucked the spear out of the Egyptian ' s hand , and slew him with his own spear ."
"[10, PARA#8516, SENT#1]","20 : 5 And there was war again with the Philistines ; and Elhanan the son of Jair slew Lahmi the brother of Goliath the Gittite , whose spear staff was like a weaver ' s beam ."
"[10, PARA#10128, SENT#2]","and how long shall the words of thy mouth be like a strong wind ?"
"[10, PARA#10178, SENT#3]","11 : 12 For vain men would be wise , though man be born like a wild ass ' s colt ."
"[10, PARA#10203, SENT#1]","12 : 25 They grope in the dark without light , and he maketh them to stagger like a drunken man ."
"[10, PARA#10226, SENT#1]","14 : 2 He cometh forth like a flower , and is cut down : he fleeth also as a shadow , and continueth not ."
"[10, PARA#10230, SENT#1]","14 : 8 Though the root thereof wax old in the earth , and the stock thereof die in the ground ; 14 : 9 Yet through the scent of water it will bud , and bring forth boughs like a plant ."
"[10, PARA#10271, SENT#1]","16 : 14 He breaketh me with breach upon breach , he runneth upon me like a giant ."
"[10, PARA#10315, SENT#1]","19 : 10 He hath destroyed me on every side , and I am gone : and mine hope hath he removed like a tree ."
"[10, PARA#10357, SENT#1]","21 : 11 They send forth their little ones like a flock , and their children dance ."
"[10, PARA#10663, SENT#2]","38 : 3 Gird up now thy loins like a man ; for I will demand of thee , and answer thou me ."
"[10, PARA#10690, SENT#1]","40 : 6 Then answered the LORD unto Job out of the whirlwind , and said , 40 : 7 Gird up thy loins now like a man : I will demand of thee , and declare thou unto me ."
"[10, PARA#10698, SENT#1]","40 : 17 He moveth his tail like a cedar : the sinews of his stones are wrapped together ."
"[10, PARA#10726, SENT#1]","41 : 31 He maketh the deep to boil like a pot : he maketh the sea like a pot of ointment ."
"[10, PARA#10749, SENT#1]","1 : 3 And he shall be like a tree planted by the rivers of water , that bringeth forth his fruit in his season ; his leaf also shall not wither ; and whatsoever he doeth shall prosper ."
"[10, PARA#10761, SENT#1]","2 : 9 Thou shalt break them with a rod of iron ; thou shalt dash them in pieces like a potter ' s vessel ."
"[10, PARA#10806, SENT#1]","7 : 2 Lest he tear my soul like a lion , rending it in pieces , while there is none to deliver ."
"[10, PARA#11028, SENT#1]","22 : 15 My strength is dried up like a potsherd ; and my tongue cleaveth to my jaws ; and thou hast brought me into the dust of death ."
"[10, PARA#11123, SENT#1]","29 : 6 He maketh them also to skip like a calf ; Lebanon and Sirion like a young unicorn ."
"[10, PARA#11153, SENT#1]","31 : 12 I am forgotten as a dead man out of mind : I am like a broken vessel ."
"[10, PARA#11295, SENT#1]","37 : 35 I have seen the wicked in great power , and spreading himself like a green bay tree ."
"[10, PARA#11334, SENT#1]","39 : 11 When thou with rebukes dost correct man for iniquity , thou makest his beauty to consume away like a moth : surely every man is vanity ."
"[10, PARA#11524, SENT#1]","52 : 2 The tongue deviseth mischiefs ; like a sharp razor , working deceitfully ."
"[10, PARA#11530, SENT#1]","52 : 8 But I am like a green olive tree in the house of God : I trust in the mercy of God for ever and ever ."
"[10, PARA#11550, SENT#1]","55 : 6 And I said , Oh that I had wings like a dove !"
"[10, PARA#11609, SENT#1]","59 : 6 They return at evening : they make a noise like a dog , and go round about the city ."
"[10, PARA#11617, SENT#1]","59 : 14 And at evening let them return ; and let them make a noise like a dog , and go round about the city ."
"[10, PARA#11666, SENT#1]","64 : 3 Who whet their tongue like a sword , and bend their bows to shoot their arrows , even bitter words :"
"[10, PARA#11926, SENT#1]","77 : 20 Thou leddest thy people like a flock by the hand of Moses and Aaron ."
"[10, PARA#11978, SENT#1]","78 : 52 But made his own people to go forth like sheep , and guided them in the wilderness like a flock ."
"[10, PARA#11983, SENT#1]","78 : 57 But turned back , and dealt unfaithfully like their fathers : they were turned aside like a deceitful bow ."
"[10, PARA#11991, SENT#1]","78 : 65 Then the LORD awaked as one out of sleep , and like a mighty man that shouteth by reason of wine ."
"[10, PARA#12012, SENT#1]","80 : 1 Give ear , O Shepherd of Israel , thou that leadest Joseph like a flock ; thou that dwellest between the cherubims , shine forth ."
"[10, PARA#12069, SENT#1]","83 : 13 O my God , make them like a wheel ; as the stubble before the wind ."
"[10, PARA#12238, SENT#1]","92 : 12 The righteous shall flourish like the palm tree : he shall grow like a cedar in Lebanon ."
"[10, PARA#12342, SENT#1]","102 : 6 I am like a pelican of the wilderness : I am like an owl of the desert ."
"[10, PARA#12362, SENT#1]","102 : 26 They shall perish , but thou shalt endure : yea , all of them shall wax old like a garment ; as a vesture shalt thou change them , and they shall be changed :"
"[10, PARA#12388, SENT#1]","104 : 2 Who coverest thyself with light as with a garment : who stretchest out the heavens like a curtain :"
"[10, PARA#12462, SENT#1]","105 : 41 He opened the rock , and the waters gushed out ; they ran in the dry places like a river ."
"[10, PARA#12541, SENT#1]","107 : 27 They reel to and fro , and stagger like a drunken man , and are at their wit ' s end ."
"[10, PARA#12555, SENT#1]","107 : 41 Yet setteth he the poor on high from affliction , and maketh him families like a flock ."
"[10, PARA#12797, SENT#1]","119 : 83 For I am become like a bottle in the smoke ; yet do I not forget thy statutes ."
"[10, PARA#12890, SENT#1]","119 : 176 I have gone astray like a lost sheep ; seek thy servant ; for I do not forget thy commandments ."
"[10, PARA#13083, SENT#1]","140 : 3 They have sharpened their tongues like a serpent ; adders ' poison is under their lips ."
"[10, PARA#13630, SENT#1]","17 : 22 A merry heart doeth good like a medicine : but a broken spirit drieth the bones ."
"[10, PARA#13796, SENT#1]","23 : 32 At the last it biteth like a serpent , and stingeth like an adder ."
"[10, PARA#14207, SENT#1]","2 : 17 Until the day break , and the shadows flee away , turn , my beloved , and be thou like a roe or a young hart upon the mountains of Bether ."
"[10, PARA#14357, SENT#1]","5 : 26 And he will lift up an ensign to the nations from far , and will hiss unto them from the end of the earth : and , behold , they shall come with speed swiftly : 5 : 27 None shall be weary nor stumble among them ; none shall slumber nor sleep ; neither shall the girdle of their loins be loosed , nor the latchet of their shoes be broken : 5 : 28 Whose arrows are sharp , and all their bows bent , their horses ' hoofs shall be counted like flint , and their wheels like a whirlwind : 5 : 29 Their roaring shall be like a lion , they shall roar like young lions : yea , they shall roar , and lay hold of the prey , and shall carry it away safe , and none shall deliver it ."
"[10, PARA#14430, SENT#1]","10 : 13 For he saith , By the strength of my hand I have done it , and by my wisdom ; for I am prudent : and I have removed the bounds of the people , and have robbed their treasures , and I have put down the inhabitants like a valiant man : 10 : 14 And my hand hath found as a nest the riches of the people : and as one gathereth eggs that are left , have I gathered all the earth ; and there was none that moved the wing , or opened the mouth , or peeped ."
"[10, PARA#14544, SENT#2]","17 : 13 The nations shall rush like the rushing of many waters : but God shall rebuke them , and they shall flee far off , and shall be chased as the chaff of the mountains before the wind , and like a rolling thing before the whirlwind ."
"[10, PARA#14548, SENT#1]","18 : 4 For so the LORD said unto me , I will take my rest , and I will consider in my dwelling place like a clear heat upon herbs , and like a cloud of dew in the heat of harvest ."
"[10, PARA#14605, SENT#1]","22 : 18 He will surely violently turn and toss thee like a ball into a large country : there shalt thou die , and there the chariots of thy glory shall be the shame of thy lord ' s house ."
